{
  "conversation_id": "c9e5f3a0-7d4b-4c9f-0e8a-3b6d9c5f1a7e",
  "direction": "OUTBOUND",
  "business_line": "COLLECTIONS",
  "queue": "ESCALATION",
  "agent_id": "A2033",
  "agent_name": "Lisa Park",
  "team": "COLL_TEAM_2",
  "site": "BNE",
  "portfolio_id": "PORTFOLIO_P3",
  "campaign_id": "DEC_OUTBOUND_HIGH_VALUE",
  "call_outcome": "TRANSFERRED",
  "started_at": "2025-12-28T11:35:00+11:00",
  "ended_at": "2025-12-28T11:48:22+11:00",
  "duration_sec": 802,
  "labels": {
    "priority": "HIGH",
    "test_case": "escalation_hardship_complaint_transfer",
    "expected_risk_flags": ["COMPLAINT_THREAT", "HARDSHIP_INDICATOR", "EXCESSIVE_CONTACT_CLAIM", "ESCALATION_REQUEST"],
    "expected_next_actions": ["TRANSFER_TO_SUPERVISOR", "APPLY_COLLECTION_HOLD", "FLAG_FOR_QA_REVIEW", "UPDATE_HARDSHIP_STATUS"]
  }
}
