
{
  "conversation_id": "9c8f3c2a-4fd2-4e7b-9b41-2fb2b4e6a2d1",
  "direction": "OUTBOUND",
  "business_line": "COLLECTIONS",
  "queue": "STANDARD",
  "agent_id": "A1029",
  "agent_name": "Maya Singh",
  "team": "COLL_TEAM_1",
  "site": "SYD",
  "portfolio_id": "PORTFOLIO_P1",
  "campaign_id": "DEC_OUTBOUND_REMINDER",
  "call_outcome": "PAYMENT_PLAN_AGREED",
  "started_at": "2025-12-28T10:02:10+11:00",
  "ended_at": "2025-12-28T10:09:45+11:00",
  "duration_sec": 455,
  "labels": {
    "priority": "HIGH",
    "test_case": "angry_customer_contact_pref_update_email_capture",
    "expected_risk_flags": ["COMPLAINT_THREAT", "CONTACT_PREF_CHANGE", "NEGATIVE_SENTIMENT"],
    "expected_next_actions": ["UPDATE_CONTACT_PREF", "SEND_PLAN_EMAIL", "FLAG_COMPLAINT_RISK"]
  }
}

