{
  "conversation_id": "3f2d9e4b-1a74-4f35-8bb2-9d8f8df0b6a7",
  "direction": "INBOUND",
  "business_line": "COLLECTIONS",
  "queue": "HARDSHIP",
  "agent_id": "A2044",
  "agent_name": "Chris Morgan",
  "team": "COLL_TEAM_2",
  "site": "SYD",
  "portfolio_id": "PORTFOLIO_P2",
  "campaign_id": null,
  "call_outcome": "PAYMENT_PLAN_AGREED",
  "started_at": "2025-12-28T11:14:03+11:00",
  "ended_at": "2025-12-28T11:26:40+11:00",
  "duration_sec": 757,
  "labels": {
    "priority": "HIGH",
    "test_case": "hardship_vulnerability_payment_plan",
    "expected_risk_flags": ["HARDSHIP_INDICATOR", "VULNERABILITY_MENTAL_HEALTH", "CONTACT_PREF_CHANGE"],
    "expected_next_actions": ["APPLY_HARDSHIP_FLAG", "UPDATE_CONTACT_PREF", "SEND_PLAN_EMAIL", "SCHEDULE_REVIEW"]
  }
}

