{
  "conversation_id": "2b6f5c61-9e3a-4e47-8b8c-3f0c5f6c2d0e",
  "direction": "INBOUND",
  "business_line": "LOANS",
  "queue": "SUPPORT",
  "agent_id": "L5512",
  "agent_name": "Alex Chen",
  "team": "LOAN_TEAM_1",
  "site": "SYD",
  "portfolio_id": null,
  "campaign_id": null,
  "call_outcome": "RESOLVED_WITH_ACTION",
  "started_at": "2025-12-28T14:20:02+11:00",
  "ended_at": "2025-12-28T14:28:30+11:00",
  "duration_sec": 508,
  "labels": {
    "priority": "MEDIUM",
    "test_case": "loan_support_payment_issue_contact_pref_update",
    "expected_risk_flags": ["CUSTOMER_FRUSTRATION", "PRODUCT_FEEDBACK", "CONTACT_PREF_CHANGE"],
    "expected_next_actions": ["APPLY_GRACE_NOTE", "UPDATE_CONTACT_PREF", "SEND_CASE_EMAIL", "LOG_PRODUCT_FEEDBACK"]
  }
}

